{
  "id": "folo/effects",
  "version": "1.0.0",
  "folo": ">=1.0 <2",
  "name": "FOLO effects",
  "description": "Whole-strip effects, including the LedFx-inspired ones.",
  "license": "MIT",
  "authors": [
    "FOLO contributors"
  ],
  "tags": [
    "effects"
  ],
  "requires": {},
  "contents": {
    "palettes": [],
    "reactions": [],
    "looks": [],
    "scenes": [
      "alternating-flicker",
      "strobe-sparkle",
      "bass-burst",
      "collide",
      "mirror-spectrum",
      "vu-meter",
      "equalizer-bands",
      "bass-vs-treble",
      "starfield",
      "color-drift",
      "breathing",
      "beat-sync",
      "half-time-pulse",
      "ambient-zones",
      "ledfx-energy",
      "ledfx-scroll",
      "ledfx-wavelength",
      "ledfx-power",
      "ledfx-rain",
      "ledfx-spotlight",
      "ledfx-scan",
      "ledfx-scan-multi",
      "ledfx-strobe",
      "ledfx-blade-power",
      "ledfx-bar",
      "ledfx-multicolor-bar",
      "ledfx-bands",
      "ledfx-equalizer",
      "ledfx-blocks",
      "ledfx-fire",
      "ledfx-lava-lamp",
      "ledfx-marching"
    ],
    "zone_templates": []
  },
  "files": {
    "scenes/alternating-flicker.json": "8c3585937449ee5dbb8e20950994bdf9ab7a2cb81b4ea35b8738d6e84db53e7d",
    "scenes/ambient-zones.json": "4133d095abb9cca205bdec217c655bb0947467097c3a1946fb5d21095c5df6b7",
    "scenes/bass-burst.json": "53628b6233c3308660a8aaff2a81b2ce84ebcc5e6b6d983a889da6fe024f7116",
    "scenes/bass-vs-treble.json": "7d49327367853141ce6d30a4f5653ac0209a7c2d8a62edd7d9ae2a84b20347a8",
    "scenes/beat-sync.json": "d6314941e6a0b5c01a8ff5a04947e5bd725a909904292536ddf110bd0ac3f7d6",
    "scenes/breathing.json": "67bb0a249f0dc4fab0ee7a50b94e1f94e5f7f3c6acab11b5f3f01efaaa76aa0e",
    "scenes/collide.json": "8109fd7b96714083d7df083c5e5d993c4150b388c223d5b1ed5384450fe407ad",
    "scenes/color-drift.json": "419fa9ef926280f6ce40911189ea9e9f8b72c7a76b3349dcb98fa1e73e7eb689",
    "scenes/equalizer-bands.json": "dd5e8747cb53df38c1ac206af42881e9d58f2e7478fafc391cc73af0c3e2307b",
    "scenes/half-time-pulse.json": "d6d68bec3c28c09b72812ed806f463fe404a0e654558540d20615aa8e0eff9ba",
    "scenes/ledfx-bands.json": "e4ae1f8450c9d3ba8e3ebeb00451ac29e78b57fa86fcdeccf89fa849d5881a40",
    "scenes/ledfx-bar.json": "b5fda5a394a30f6705677326c99d2ccde95e23124179578be17179e8929fc71b",
    "scenes/ledfx-blade-power.json": "14818ac2eb2d9e4d0cc19fdd411dc0f305f52990d7983c7de71a4a4029a45ba5",
    "scenes/ledfx-blocks.json": "f69dba57020df459e94b721e71ba5783b4abb0fddfbf3e313b8b88bd660c62d9",
    "scenes/ledfx-energy.json": "3e7b1f692cac4a795d0657ce263ed35f143c2f295efaa0a25b6b2382835618ca",
    "scenes/ledfx-equalizer.json": "5a4d2297d052f7839a512ca6f531292554b451a21657e9adb588277e1226d868",
    "scenes/ledfx-fire.json": "db4581b013c29d77d4e2012da2427f0e52b469e332c936ac1c222f0ff0fdea92",
    "scenes/ledfx-lava-lamp.json": "d33e09209362f2780ee970bd93953a0a3c3f8a8cdadb95c308f934306c638e45",
    "scenes/ledfx-marching.json": "8c7fecb2b9b994fd412f22fd0c0c5f24a0c30e14247e30c5576e6f6ed350bc13",
    "scenes/ledfx-multicolor-bar.json": "86ab2875e11d0dcfeff750624385620acd5260b8a0998f6d2a653e481c9a7183",
    "scenes/ledfx-power.json": "36f74a30f6d791f997e16fabb8bee7d02b45b6a0b8228d68d0d9be113d1f3a36",
    "scenes/ledfx-rain.json": "25514de81771e835e932df4839a8c8b7e4eb412e11fa6dc7c43b2c1000f845be",
    "scenes/ledfx-scan-multi.json": "c2538181e6b56737cbaf4167ced1d1fbf6670b1f5a28fb3d5578953c892920d6",
    "scenes/ledfx-scan.json": "b374370de9e2c491c3e655c6daeba795ebf7db87950c33fa7ee348b060798f21",
    "scenes/ledfx-scroll.json": "b0dd291e5de6969c91865a485d9419a6fccdfd3cc4e8b6247d5e174ea7248ca2",
    "scenes/ledfx-spotlight.json": "92232f1f144eade90203ce982ac58d38fe2d3c475ae97319a38298adc4df5a1e",
    "scenes/ledfx-strobe.json": "7575a0534b08d5735ba43311328d1ce7f7690b4a09d0a302eacba3df5b6c6468",
    "scenes/ledfx-wavelength.json": "706fe429224b343ca54f69e4c4736d357fc3d880d68d8a2c0a62a6c0b97e58ad",
    "scenes/mirror-spectrum.json": "7d7495c18cb9d3fce73d40107543b8c2583881808c6dfd54c9fa4af716a882af",
    "scenes/starfield.json": "f86b7466a6bcff2a2c8619849e7bf7f23bf0a69315edda1518105f0ce6128ec3",
    "scenes/strobe-sparkle.json": "f6df1ac5a163a7d498409f93819a15c5dc989b5ee728d6b987b6e950756b83c0",
    "scenes/vu-meter.json": "8d5b32306ac9374439e433fa2e085fbcf61aec4f394ffd7a262cd161b1ec0ca2"
  },
  "previews": {}
}
